ID,頭文字,品目名,読み,類似語,出し方（一覧）,出し方（詳細）,出し方のポイント,URL1
3,あ,アームスタンド,あーむすたんど,モニタースタンド,小物金属,粗大ごみ,最長辺30cm以上のものは粗大ごみとして出してください。,
4,あ,アームバンド,あーむばんど,,普通ごみ,,,
2,あ,IH調理器,あいえいちりょうりき,電磁調理器 IHクッキングヒーター 電気調理器 ハロゲンプレート 電磁調理台 ih調理機 インダクションレンジ 卓上IH ハロゲンコンロ,小物金属,粗大ごみ,最長辺30cm以上のものは粗大ごみとして出してください。/長辺30cm未満で、30cm×15cmの回収ボックスの投入口に入るものは小型家電としても出すことができます。,http://www.city.kawasaki.jp/kurashi/category/24-1-23-1-1-6-9-0-0-0.html
1,あ,ICレコーダー,あいしーれこーだー,ボイスレコーダー 録音機,小物金属,,長辺30cm未満で、30cm×15cmの回収ボックスの投入口に入るものは小型家電としても出すことができます。,http://www.city.kawasaki.jp/kurashi/category/24-1-23-1-1-6-9-0-0-0.html
5,あ,アイシャドウチップ,あいしゃどうちっぷ,化粧チップ,普通ごみ,,,
6,あ,アイスクラッシャー,あいすくらっしゃー,,普通ごみ,小物金属,金属製のものは小物金属として出してください。,
7,あ,アイスクリームのふた(プラスチック製),あいすくりーむのふた（ぷらすちっくせい）,アイスのふた アイスのフタ アイスの内ぶた,プラスチック製容器包装,普通ごみ,識別表示を確認して出してください。/汚れのひどいものは普通ごみとして出してください。,
8,あ,アイスクリームのふた(紙製),あいすくりーむのふた（かみせい）,アイスのふた アイスのフタ アイスの内ぶた,ミックスペーパー,普通ごみ,汚れがひどいものは普通ごみとして出してください。,
9,あ,アイスクリームの容器・包装(プラスチック製),あいすくりーむのようきほうそうぷらすちっくせい,アイスクリームのカップ アイスの容器 アイス容器 アイスのカップ アイスカップ アイスクリーム容器 アイスクリームカップ Coolish クーリッシュ カップアイス カップアイスクリーム アイスの包紙 アイスの外装 アイスキャンデー外装 アイス外装 チューペット,プラスチック製容器包装,普通ごみ,識別表示を確認して出してください。/汚れのひどいものは普通ごみとして出してください。,
10,あ,アイスクリームの容器・包装(紙製),あいすくりーむのようきほうそうかみせい,アイスクリームのカップ アイスの容器 アイス容器 アイスのカップ アイスカップ アイスクリーム容器 アイスクリームカップ アイスクリームの紙カップ カップアイス カップアイスクリーム アイスの外装 アイスキャンデー外装 アイス外装,ミックスペーパー,普通ごみ,汚れがひどいものは普通ごみとして出してください。,
11,あ,アイスクリームメーカー,あいすくりーむめーかー（きんぞくせい）,アイスクリーム製造機 アイスクリーマー アイスクリーム機 アイスメーカー,粗大ごみ,小物金属,最長辺30cm未満のものは小物金属として出してください。,
12,あ,アイスの棒,あいすのぼう,アイス棒,普通ごみ,,,
13,あ,アイスピック,あいすぴっく,,小物金属,,厚紙等で包み「刃物キケン」と表示して出してください。,
14,あ,アイスペール(ガラス製),あいすぺーる,氷入れ アイスバケツ,普通ごみ,,,
16,あ,アイスペール(金属製),あいすぺーる（きんぞくせい）,アイスバケツ,小物金属,粗大ごみ,最長辺30cm以上のもには粗大ごみとして出してください。,
15,あ,アイスペール(プラスチック製),あいすぺーる（ぷらすちっくせい）,アイスバケツ,普通ごみ,粗大ごみ,最長辺50cm以上のものは粗大ごみとして出してください。,
18,あ,アイスホッケー防具,あいすほっけーぼうぐ,,粗大ごみ,普通ごみ,最長辺50cm未満のものは普通ごみとして出してください。,
17,あ,アイスボックス,あいすぼっくす,,粗大ごみ,普通ごみ,最長辺50cm未満のものは普通ごみとして出してください。,
19,あ,アイゼン,あいぜん,,小物金属,,,
20,あ,アイマスク,あいますく,スチームアイピロー アイピロー,普通ごみ,,,
21,あ,アイライナー・アイブロー,あいらいなー,アイペンシル 化粧鉛筆 アイブロウペンシル アイライン アイブラシ ペンシルアイライナー 眉ペン,普通ごみ,,,
22,あ,アイロン,あいろん,電気アイロン スチームアイロン コードレスアイロン 自動裁縫こて アイロンスチーマー ガスアイロン,小物金属,,,
23,あ,アイロンケース(プラスチック製),あいろんけーす（ぷらすちっくせい）,,普通ごみ,粗大ごみ,最長辺50cm以上のものは粗大ごみとして出してください。,
27,あ,アイロン台,あいろんだい,仕上げ馬 アイロン掛け台 アイロンだい アイロンの台 アイロンスタンド,粗大ごみ,小物金属,最長辺30cm未満のものは小物金属として出してください。,
28,あ,アイロン台カバー,あいろんだいかばー,,普通ごみ,,,
24,あ,アイロンバッグ,あいろんばっぐ,,普通ごみ,粗大ごみ,最長辺50cm以上のものは粗大ごみとして出してください。,
25,あ,アイロンプリント紙,あいろんぷりんとし,アイロン熱転写紙 アイロンシート,ミックスペーパー,,,
26,あ,アイロンマット,あいろんまっと,,普通ごみ,粗大ごみ,排出時に最長辺50cm以上のものは粗大ごみとして出してください。,
29,あ,アウトドア用椅子（金属製）,あうとどあよういす（きんぞくせい）,キャンプ用いす ディレクターズチェア キャンプ用椅子 キャンピングチェア キャンプ用品 キャンプいす レジャーチェア レジャーチェアー デレクターズチェア レジャー椅子 アウトドアチェア サマーチェアー ガーデンチェアー キャンプ椅子 キャンプ用イス ピクニックチェアー キャンプベンチ 三脚イス アウトドア椅子 アウトドア用チェアー キャンプチェア キャンプチェアー バーベキューチェアー アウトドアチェアー ディレクターズチェアー ディレクターチェアー 金属の椅子 アウトドア用いす 野外用椅子 キャンピングチェアー キャンプイス フォールディングチェア キャンプのいす,粗大ごみ,小物金属,最長辺30cm未満のものは小物金属として出してください。,
30,あ,アウトドア用椅子（金属製以外）,あうとどあよういす（きんぞくせいいがい）,キャンプ用いす ディレクターズチェア キャンプ用椅子 キャンピングチェア キャンプ用品 キャンプいす レジャーチェア レジャーチェアー デレクターズチェア レジャー椅子 アウトドアチェア サマーチェアー ガーデンチェアー キャンプ椅子 キャンプ用イス ピクニックチェアー キャンプベンチ 三脚イス アウトドア椅子 アウトドア用チェアー キャンプチェア キャンプチェアー バーベキューチェアー アウトドアチェアー ディレクターズチェアー ディレクターチェアー 金属の椅子 アウトドア用いす 野外用椅子 キャンピングチェアー キャンプイス フォールディングチェア キャンプのいす,粗大ごみ,普通ごみ,最長辺50cm未満のものは普通ごみとして出してください。,
84,あ,青焼き,あおやき,,ミックスペーパー,,,
31,あ,あかすり,あかすり,アカスリ あかすりタオル,普通ごみ,,,
32,あ,アクセサリー,あくせさりー,カチューシャ ネックレス ピアス 髪飾り 髪留め イヤリング 装飾品 シルバー ブローチ パール バレッタ 真珠 ヘアアクセサリー ヘアクリップ 腕輪 ブレスレッド 髪どめ ダッカール ヘア止め 金属の装飾品 小さな貴金属 ブレスレット かみどめ バングル ヘアバレッタ ぴんどめ ヘアーアクセサリー イアリング ラインストーン 磁気ネックレス ビーズアクセサリー ティアラ かみとめ 髪止め かんざし バンスクリップ おもちゃの指輪 バナナクリップ ヘア飾り かみかざり ばれった ループタイ チョーカー 簪 ヘアコーム シルバーアクセサリー ヘアークリップ ペンダントトップ 銀アクセサリー,小物金属,普通ごみ,金属製以外のものは普通ごみとして出してください。,
35,あ,あく取り,あくとり,アク取り アク取りおたま,小物金属,普通ごみ,プラスチック製のものは普通ごみとして出してください。,
71,あ,握力計,あくりょくけい,握力器,小物金属,粗大ごみ,最長辺30cm以上のものは粗大ごみとして出してください。,
33,あ,アクリルケース,あくりるけーす,アクリル樹脂 メタクリル樹脂 保存容器ケース 小物入れ アクリルの箱 小物いれ アクリルボックス 小物ケース 樹脂製品 小物箱 アクリル容器 観察ケース リーフレットケース パンフレットケース アクリルスタンド,普通ごみ,粗大ごみ,最長辺50cm以上のものは粗大ごみとして出してください。,
34,あ,アクリル製・プラスチック製の板,あくりるばん,アクリル板 アクリル樹脂 メタクリル樹脂 アクリルボード プラ板 プラスチック製ボード 塩ビ板 塩化ビニール板 ベーク板 プラスチック板 プラスチックボード プラスチック製板 プラスティック板 アクリルフレーム アクリルパネル クリアボード 樹脂板 樹脂製の板,普通ごみ,粗大ごみ,最長辺50cm以上のものは粗大ごみとして出してください。,
36,あ,アコーディオンカーテン,あこーでぃおんかーてん,アコーデオンカーテン,粗大ごみ,,,
37,あ,アコーディオンドア,あこーでぃおんどあ,アコーデオンドア パネルドア,粗大ごみ,,,
38,あ,アコーディオンフェンス,あこーでぃおんふぇんす,,粗大ごみ,,5個までを1個として出すことができます。,
96,あ,麻ひも,あさひも,麻紐,普通ごみ,,,
72,あ,葦,あし,ござ ゴザ,普通ごみ,,,
86,あ,足蹴り自転車,あしけりじてんしゃ,ストライダー,粗大ごみ,,,
87,あ,足蹴り乗用玩具(おもちゃ車),あしげりじょうようがんぐ（おもちゃぐるま）,おもちゃの乗り物 おもちゃ自動車 コンビカー 乗り物玩具 子供乗り物 車のオモチャ おもちゃの車 幼児乗り物 足こぎ車 幼児用車 子どもの車 玩具の車 押しぐるま 足こぎ自動車 子供の乗り物 子供自動車 車のおもちゃ 子ども車 子供用車 子供の車 子供用三輪車 おもちゃのくるま 玩具の乗り物 足けり車 足蹴り車 バギーカー,粗大ごみ,普通ごみ,プラスチック製・木製で最長辺50cm未満のものは普通ごみとして出してください。,
85,あ,足ひれ(フィン),あしひれ（ふぃん）,ダイビングフィン 足ヒレ ダイビング用フィン ダイビング用足ひれ マリンフィン,普通ごみ,粗大ごみ,最長辺50cm以上のものは粗大ごみとして出してください。,
88,あ,足拭きマット,あしふきまっと,バスマット 玄関マット 風呂マット お風呂マット お風呂用マット バスシート 浴室マット バスフロアマット おふろマット お風呂のマット 足ふき ラバーすのこ 風呂場マット 足ふきマット あしふきマット 風呂場の足ふき 玄関カーペット 屋外マット フワフワマット 脚ふきマット ミニマット ドアマット あし拭きマット 玄関まっと 吸水マット 脱衣所マット,普通ごみ,,,
80,あ,汗取りマット,あせとりまっと,,普通ごみ,,,
39,あ,アタッシュケース（金属製）,あたっしゅけーす（きんぞくせい）,ジェラルミンケース ジュラルミンケース アルミアタッシュケース ソフトアタッシュケース,粗大ごみ,小物金属,最長辺30cm未満のものは小物金属として出してください。 ,
40,あ,アタッシュケース（金属製以外）,あたっしゅけーす（きんぞくせいいがい）,ジェラルミンケース ジュラルミンケース アルミアタッシュケース ソフトアタッシュケース,粗大ごみ,普通ごみ,最長辺50cm未満のものは普通ごみとして出してください。,
73,あ,圧縮袋,あっしゅくぶくろ,ふとん圧縮袋 布団圧縮袋 布団の圧縮袋 ビニール圧縮袋 圧縮布団袋 圧縮ビニール袋 圧縮ふとん袋 圧縮ふくろ 圧縮ぶくろ ナイロン圧縮袋 布団圧縮パック 圧縮パック 衣類圧縮袋 衣類収納袋 衣類整理袋,普通ごみ,,,
83,あ,厚紙,あつがみ,ボール紙 板紙,ミックスペーパー,,,
41,あ,アトマイザー(香水噴霧器),あとまいざー（こうすいふんむき：きんぞくせい）,,小物金属,,,
42,あ,アトマイザー(香水噴霧器)のキャップ・ノズル,あとまいざー（こうすいふんむき）のきゃっぷ・のずる,,普通ごみ,プラスチック製容器包装,中身の製品（香水等）を購入した際の容器はプラスチック製容器包装として出してください。（識別表示を確認して出してください。）,
43,あ,アトマイザー(香水噴霧器:プラスチック製),あとまいざー（こうすいふんむき：ぷらすちっくせい）,,普通ごみ,プラスチック製容器包装,中身の製品（香水等）を購入した際の容器はプラスチック製容器包装として出してください。（識別表示を確認して出してください。）,
81,あ,穴あけパンチ(プラスチック製),あなあけぱんち（ぷらすちっくせい）,ホールパンチ 穴開けパンチ 穴あけ機 穴あきパンチ クラフトパンチ ハンドパンチ,普通ごみ,,最長辺50cm以上のものは粗大ごみとして出してください。,
82,あ,穴あけパンチ(金属製),あななけぱんち（きんぞくせい）,ホールパンチ 穴開けパンチ 穴あけ機 穴あきパンチ クラフトパンチ ハンドパンチ,小物金属,,最長辺30cm以上のものは粗大ごみとして出してください。,
100,あ,油紙,あぶらかみ,あぶら紙,普通ごみ,ミックスペーパー,未使用のものはミックスペーパーとして出してください。,
44,あ,あぶら取り紙,あぶらとりがみ,油とり紙 あぶらとり あぶらとり紙 油取り紙,普通ごみ,ミックスペーパー,未使用のものはミックスペーパーとして出してください。,
99,あ,油引き,あぶらひき,,普通ごみ,小物金属,金属製のものは小物金属として出してください。,
79,あ,雨合羽 あまがっぱ(ゴム・ビニール製),あまがっぱごむびにーるせい,雨ガッパ レインコート レインウェア かっぱ カッパ 雨具 レインスーツ 雨カッパ ビニールカッパ 雨ガッパ 雨ガッパ 防寒カッパ 雨かっぱ アマガッパ ビニール雨カッパ ビニールかっぱ,普通ごみ,,,
78,あ,雨戸,あまど,,粗大ごみ,,ふすま・網戸・雨戸を5枚までを1個として出すことができます。,
77,あ,雨どい,あまどい,雨樋 雨とい あまとい 軒樋,粗大ごみ,普通ごみ,最長辺50cm未満のものは普通ごみとして出してください。,
89,あ,編み機,あみき,,粗大ごみ,小物金属,金属製で最長辺30cm未満のものは小物金属として出してください。,
45,あ,あみじゃくし,あみじゃくし,網杓子 あみしゃくし 網じゃくし,小物金属,,,
97,あ,網戸,あみど,あみ戸 ロール網戸 網戸枠,粗大ごみ,,ふすま・網戸・雨戸を5枚までを1個として出すことができます。,
98,あ,網戸の網,あみどのあみ,網戸ネット 網戸のアミ 網戸のネット 網戸のあみ 網戸用網 網戸網,普通ごみ,,,
46,あ,あみ針(木製・プラスチック製),あみはり（もくせい・ぷらすちっくせい）,,普通ごみ,小物金属,金属製のものは小物金属として出してください。,
90,あ,編み針,あみばり,,普通ごみ,小物金属,金属製のものは小物金属として出してください。,
91,あ,編み棒,あみぼう,かぎぼう あみもの棒 あみ棒 編棒 編み物棒,普通ごみ,小物金属,金属製のものは小物金属として出してください。,
47,あ,あめの棒,あめのぼう,,普通ごみ,,,
101,あ,アルコール温度計,あるこーるおんどけい,,普通ごみ,,厚紙等等に包み「品名」を表示して出してください。,
48,あ,アルコールランプ(ガラス製),あるこーるらんぷ,オイルランプ,普通ごみ,,アルコールや油は使いきって出してください。/使いきれない場合は布等に染み込ませて普通ごみとして出してください。,
51,あ,アルバム（プラスチック製）,あるばむ,フォトブック ポケットアルバム台紙 写真アルバム 卒業アルバム フォトアルバム アルバムケース アルバムの台紙 アルバム張 写真アルバム張 写真帳 フエルアルバム 写真のアルバム 写真ファイル,普通ごみ,,写真はミックスペーパーとして出してください。,
50,あ,アルバム（紙製）,あるばむ（かみせい）,フォトブック ポケットアルバム台紙 写真アルバム 卒業アルバム フォトアルバム アルバムケース アルバムの台紙 アルバム張 写真アルバム張 写真帳 フエルアルバム 写真のアルバム 写真ファイル,ミックスペーパー,,金属部分は外して小物金属として出してください。/金属部分が外せない場合はそのままミックスペーパーとして出してください。/写真はミックスペーパーとして出してください。,
58,あ,アルミ缶(飲料用・食品用),あるみかんいんりょうようしょくりょうよう,飲料缶 飲み物の缶 お菓子の空き缶箱 炭酸飲料 金属缶 アルミの缶 アルミ容器 アルミカン あき缶 食品缶ジュース 空缶 金属容器 空きかん 飲み物容器 ウーロン茶 空きカン 缶容器 かんずめ お菓子缶詰 金属製缶 金属の缶 ジュースの缶 水缶 油のかん 金属カン 調味料の缶 調味料のカン アルミ缶詰め シーチキンのかん コーラ アルミかん チェリオ ライフガード ペプシ,空き缶・ペットボトル,,大きさによらず飲料・食品の缶は空き缶・ペットボトルとして出してください。,
59,あ,アルミ台,あるみだい,作業台,粗大ごみ,小物金属,最長辺30cm未満のものは小物金属として出してください。,
52,あ,アルミテープ,あるみてーぷ,バロンテープ クロステープ,普通ごみ,,,
53,あ,アルミはく、アルミホイル,あるみはくあるみほいる,アルミフォイル アルミ箔 アルミカップ アルミホイール アルミ泊 アルミフィルム アルミ蓋 アルミ紙 アルミ包み ホイルカップ アルミかっぷ アルミニウムはく アルミニウム箔,普通ごみ,,,
54,あ,アルミバッグ(カメラ・パソコン用),あるみばっぐ（かめら・ぱそこんよう）,カメラバック カメラボックス ジェラルミンケース ジュラルミンケース アルミケース カメラBOX アルミ鞄 アルミパック パソコンバック,粗大ごみ,小物金属,最長辺30cm未満のものは小物金属として出してください。,
55,あ,アルミホイルの芯,あるみほいるのしん,アルミホイルのしん,ミックスペーパー,,,
56,あ,アルミボックス,あるみぼっくす,アルミ箱 アルミ製の箱,小物金属,粗大ごみ,最長辺30cm以上のものは粗大ごみとして出してください。,
57,あ,アルミマット,あるみまっと,銀マット キャンプ用ベッド,普通ごみ,粗大ごみ,排出時に最長辺50cm以上のものは粗大ごみとして出してください。,
60,あ,アロマオイルの容器(ガラス製),あろまおいるのようき（がらすせい）,アロマオイルビン アロマ容器 アロマボトル アロマ瓶 アロマオイル瓶 アロマの瓶 遮光瓶 アロマテラピー アロマビン アロマオイルのびん アロマ油 アロマびん アロマオイルの瓶 アロマのビン,普通ごみ,,空きびんではなく普通ごみとして出してください。,
61,あ,アロマオイルの容器(プラスチック製),あろまおいるのようき（ぷらすちっくせい）,アロマオイルビン アロマ容器 アロマボトル アロマテラピー アロマビン アロマ油,普通ごみ,プラスチック製容器包装,中身の製品（アロマオイル）を購入した際の容器はプラスチック製容器包装として出してください。（識別表示を確認して出してください。）,
62,あ,アロマキャンドルのビン,あろまきゃんどるのびん,アロマキャンドルビン 瓶入りロウソク,普通ごみ,,空きびんではなく普通ごみとして出してください。,
63,あ,アロマポット(陶器・ガラス製),あろまぽっと（とうき・がらすせい）,アロマ容器 アロマランプ デフューザー アロマスタンド アロマディフューザー アロマボトル アロマ瓶 アロマデフィューザ アロマ陶器,普通ごみ,粗大ごみ,最長辺50cm以上のものは粗大ごみとして出してください。,
64,あ,アロマライト,あろまらいと,,小物金属,粗大ごみ,最長辺30cm以上のものは粗大ごみとして出してください。,
92,あ,泡立てネット,あわたてねっと,泡だてネット あわだてねっと 泡たてネット 泡だてネット 洗顔ネット,普通ごみ,,,
93,あ,泡立て器(手動:プラスチック・シリコン製),あわだてき（しゅどう：ぷらすちっく・しりこんせい）,泡だて器 ホイッパー 泡立て機 泡立器 泡立てき 泡たて器,普通ごみ,小物金属,金属製のものは小物金属として出してください。,
94,あ,泡立て器(電動),あわだてき（でんどう：きんぞくせい）,ハンドミキサー 泡だて器 ホイッパー ミルクホイッパー 泡立て機 泡立器 泡立てき 泡たて器 ハンドブレンダー フローサー ミルクフローサー 電動泡立て器 ブレンダー刃,小物金属,粗大ごみ,最長辺30cm以上のものは粗大ごみとして出してください。/長辺30cm未満で、30cm×15cmの回収ボックスの投入口に入るものは小型家電としても出すことができます。,http://www.city.kawasaki.jp/kurashi/category/24-1-23-1-1-6-9-0-0-0.html
95,あ,泡立て器(電動・プラスチック製),あわだてき（でんどう：ぷらすちっくせい）,ハンドミキサー 泡だて器 ホイッパー ミルクホイッパー 泡立て機 泡立器 泡立てき 泡たて器 ハンドブレンダー フローサー ミルクフローサー 電動泡立て器,小物金属,粗大ごみ,最長辺30cm以上のものは粗大ごみとして出してください。/長辺30cm未満で、30cm×15cmの回収ボックスの投入口に入るものは小型家電としても出すことができます。,http://www.city.kawasaki.jp/kurashi/category/24-1-23-1-1-6-9-0-0-0.html
66,あ,アンカーボルト,あんかーぼると,アンカー ボルト,小物金属,粗大ごみ,最長辺30cm以上のものは粗大ごみとして出してください。,
65,あ,あんか・足温器,あんかそくおんき,電気あんか 行火 電機アンカ 電気アンカ 電器あんか 電機あんか でんきあんか,小物金属,粗大ごみ,最長辺30cm以上のものは粗大ごみとして出してください。,
68,あ,アンクルウエイト,あんくるうえいと,パワーリスト アンクルウェイト リストウェイト リストウエイト パワーアンクル,普通ごみ,小物金属,金属製の重り等は小物金属として出してください。,
67,あ,アングル(鋼材),あんぐる（こうざい）,スチール製アングル,粗大ごみ,,概ね2mを超えるものは市では収集できません。（販売店等に相談してください。）,
75,あ,安全帯,あんぜんたい,,小物金属,,ただし、事業活動から出るものは市では収集できません。,http://www.city.kawasaki.jp/kurashi/category/24-1-25-0-0-0-0-0-0-0.html
74,あ,安全ピン,あんぜんぴん,安全ぴん,小物金属,,厚紙等で包み「品名」を表示して出してください。,
