1729,せ,扇風機,せんぷうき,卓上扇風機 冷風機 冷風扇 サーキュレーター 送風機 卓上ファン タワーファン 小型扇風機 冷風器 壁掛け扇風機 ミニ扇風機 れいふうき クリップ式扇風機 ダイソン エアーファン ポータブル扇風機 クリップ扇風機 タワー型扇風機 小さい扇風機 コンパクト扇風機 サーキュレイター,粗大ごみ,小物金属,最長辺30cm未満のものは小物金属として出してください。,
1730,せ,扇風機のカバー(布製),せんぷうきのかばー,扇風機カバー,普通ごみ,,,
1731,せ,扇風機の羽,せんぷうきのわ,扇風機のはね,普通ごみ,粗大ごみ,最長辺50cm以上のものは粗大ごみとして出してください。,
1728,せ,千枚通し,せんまいどおし,目うち 目打ち 千枚どおし めうち,小物金属,,厚紙等に包み「刃物キケン」と表示して出してください。,
1752,せ,洗面器(プラスチック製),せんめんき（ぷらすちっくせい）,洗面桶 あらいおけ 洗いおけ 風呂洗面器 プラスチック洗面器 洗面ボウル お風呂の洗面器 プラ洗面器 ポリ洗面器,普通ごみ,,洗面器はプラスチック製品なので、プラスチック製容器包装ではなく、普通ごみとして出してください。/最長辺50cm以上のものは粗大ごみとして出してください。（たらい・洗面器・おけは、5個までを1個として出すことができます。）,
1751,せ,洗面化粧台,せんめんけしょうだい,洗面台 陶器洗面台,粗大ごみ,,ただし、業者が作業したものは市では収集できません。（作業した業者に処理を依頼してください。）,
1661,せ,ゼッケン,ぜっけん,,普通ごみ,,,
1727,せ,絶縁碍子,ぜつえんがいし,,普通ごみ,,,
1726,せ,絶縁シール,ぜつえんしーる,絶縁シート,普通ごみ,,,
1667,せ,ゼリー飲料の容器(アルミパウチ),ぜりーいんりょう,ウィダーインゼリー パウチ袋 ウイダーインゼリー アルミパック,プラスチック製容器包装,,識別表示を確認して出してください。,
1776,そ,双眼鏡,そうがんきょう,オペラグラス,普通ごみ,,,
1778,そ,掃除機,そうじき,電気掃除機 掃除機のホース 掃除機ホース 家電製品 電化製品 電気製品 そうじきのホース 家庭用掃除機 床掃除機 そうじ機 電気機器 スイブルスイーパー スティック型掃除機 スティック型掃除機 掃除機ノズル ダイソン 電機掃除機 スタンド式掃除機 スティッククリーナ スティッククリーナー 縦型掃除機 コードレス掃除機 バキュームクリーナー 充電クリーナ 充電式クリーナ 充電式掃除機 充電掃除機 コードレスクリーナー サイクロン掃除機 布団掃除機 スティック掃除機 電気ほうき 充電式スティッククリーナー サイクロンクリーナー ダイソン掃除機,粗大ごみ,小物金属,最長辺30cm未満になるものは小物金属として出してください。,
1785,そ,掃除機の紙パック,そうじきのかみぱっく,掃除機パック 掃除機紙パック 掃除機用紙パック 掃除機用ゴミパック ゴミパック 掃除機の紙パック,普通ごみ,,,
1777,そ,掃除シート,そうじしーと,クイックルシート ドライシート おそうじシート ハイサッサ クイックルワイパーの紙 トイレクリーナー 化学ぞうきん,普通ごみ,,プラスチック製の容器はプラスチック製容器包装として出してください。（識別表示を確認して出してください。）,
1780,そ,掃除棒(金属製以外),そうじぼうき（きんぞくせいいがい）,そうじ棒,普通ごみ,粗大ごみ,最長辺50cm以上のものは粗大ごみとして出してください。,
1779,そ,掃除棒(金属製),そうじぼうきんぞくせい,そうじ棒,小物金属,粗大ごみ,最長辺30cm以上のものは粗大ごみとして出してください。,
1775,そ,素麺の木箱,そうめんのきばこ,素麺木箱 素麺の箱,普通ごみ,粗大ごみ,最長辺50cm以上のものは粗大ごみとして出してください。,
1760,そ,ソーセージの金具,そーせーじのかなぐ,,小物金属,,,
1761,そ,ソーチェーン,そーちぇーん,,小物金属,粗大ごみ,排出時に最長辺30cm以上のものは粗大ごみとして出してください。,
1759,そ,ソースの容器,そーふのようき,調味料のボトル ソース容器 ブルドックソース ソースの空容器 ソースのふた,プラスチック製容器包装,,中身を使いきって、軽くすすいで出してください。（識別表示を確認して出してください。）/汚れがひどいものは普通ごみとして出してください。,
1763,そ,ソーラー充電器,そーらーじゅうでんき,,小物金属,,,
1762,そ,ソーラーライト,そーらーらいと,,小物金属,粗大ごみ,最長辺30cm以上のものは粗大ごみとして出してください。,
1783,そ,測量機器,そくりょうきき,トランシット,小物金属,粗大ごみ,家庭から出るもので、最長辺30cm以上のものは粗大ごみとして出してください。/なお、事業活動から出るものは市では収集できません。,http://www.city.kawasaki.jp/kurashi/category/24-1-25-0-0-0-0-0-0-0.html
1764,そ,ソケット,そけっと,シガーソケット シガーライター カーソケット,小物金属,,,
1784,そ,底砂,そこずな,ソイル さんご砂 サンゴ砂,普通ごみ,,少量づつに分けて出してください。/多量に出さなくてはならない場合は生活環境事業所に相談してください。,
1765,そ,ソックタッチ,そっくたっち,,プラスチック製容器包装,,中身を使いきって出してください。（識別表示を確認してから出してください。）,
1766,そ,ソファー,そふぁー,籐製ソファーマット カウチソファ ラブソファー リクライニングソファー 応接用ソファ 折りたたみソファ ソファ椅子 ローソファー フロアソファー カウチソファー,粗大ごみ,,,
1767,そ,ソファーカバー,そふぁーかばー,ソファーのカバー,普通ごみ,,,
1768,そ,ソファーテーブル,そふぁーてーぶる,,粗大ごみ,,,
1769,そ,ソフトクーラーバッグ,そふとくーらーばっぐ,,普通ごみ,,,
1770,そ,ソフトワイヤー,そふとわいやー,ねじねじ ネジネジ,小物金属,,,
1771,そ,そり（金属製）,そり（きんぞくせい）,ソリ 雪遊び用そり 子供用ソリ 子供用そり プラスティック子供用そり プラスチックそり,粗大ごみ,小物金属,最長辺30cm未満のものは小物金属として出してください。 ,
1772,そ,そり（金属製以外）,そり（きんぞくせいいがい）,ソリ 雪遊び用そり 子供用ソリ 子供用そり プラスティック子供用そり プラスチックそり,粗大ごみ,普通ごみ,最長辺50cm未満のものは普通ごみとして出してください。,
1773,そ,そろばん,そろばん,算盤 ソロバン ,普通ごみ,,,
1782,そ,造花,ぞうか,フラワーアレンジ アートフラワー フェイクグリーン 人工観葉植物 アレンジメントフラワー,普通ごみ,,針金は小物金属として出してください。,
1758,そ,ぞうきん,ぞうきん,雑巾,普通ごみ,,,
1774,そ,象牙,ぞうげ,,普通ごみ,,,
1781,そ,草履,ぞうり,ゴム草履 下駄ぞうり 下駄草履 和ぞうり,普通ごみ,,,
1788,た,ターバン,たーばん,,資源集団回収,,布類（古着・古布等）回収にご協力お願いします。（洗ってから出してください。）/資源集団回収で回収ができない場合は拠点回収（WEBで見る）を行っています。/上記での回収が難しい場合や汚れているもの、破けているもの、ぬれているものは普通ごみとして出してください。,http://www.city.kawasaki.jp/kurashi/category/24-1-23-1-1-6-9-0-0-0.html
1789,た,タープ,たーぷ,,粗大ごみ,,,
1790,た,ターンテーブル(電子レンジの中のもの・金属製),たーんてーぶる（でんしれんじのなかのもの・きんぞくせい）,電子レンジの皿 電子レンジのターンテーブル,小物金属,,最長辺30cm以上のものは粗大ごみとして出してください。,
1791,た,ターンテーブル(電子レンジの中のもの・金属製以外),たーんてーぶる（でんしれんじのなかのもの・きんぞくせいいがい）,電子レンジの皿 電子レンジのターンテーブル,普通ごみ,,,
1859,た,耐火金庫,たいかきんこ,小型金庫 たいか金庫,その他,,市では収集できません。（販売店等に相談してください。）,
1860,た,耐震マット,たいしんまっと,,普通ごみ,,,
1858,た,体重計,たいじゅうけい（きんぞくせい）,ヘルスメーター 体脂肪計 ベビースケール 体組成計 デジタル体重計 体脂肪体重計 電子体重計 デジタル式体重計 体組織計 デジタルヘルスメーター,小物金属,粗大ごみ,最長辺30cm以上のものは粗大ごみとして出してください。,
1794,た,タイツ,たいつ,網たいつ 網タイツ カラータイツ 毛糸タイツ テラコッタタイル,普通ごみ,,,
1861,た,耐熱ガラス製品,たいねつがらすせいひん,パイレックス 耐熱ガラス 耐熱ビン パイレックス容器,普通ごみ,粗大ごみ,最長辺50cm以上のものは粗大ごみとして出してください。,
1795,た,タイプライター,たいぷらいたー,,粗大ごみ,小物金属,最長辺30cm未満のものは小物金属として出してください。,
1796,た,タイマー,たいまー,キッチンタイマー デジタルタイマー,小物金属,,,
1797,た,タイムレコーダー,たいむれこーだー,,小物金属,,ただし、事業活動から出るものは市では収集できません。,http://www.city.kawasaki.jp/kurashi/category/24-1-25-0-0-0-0-0-0-0.html
1799,た,タイヤカバー(自転車・自動車),たいやかばー（じてんしゃ・じどうしゃ）,自転車のタイヤカバー,普通ごみ,粗大ごみ,最長辺50cm以上のものは粗大ごみとして出してください。,
1798,た,タイヤ(自動車・バイク),たいやじどうしゃばいく,バイクタイヤ ゴムタイヤ タイア チューブレスタイヤ オートバイタイヤ 自動車タイヤ 古タイヤ バイクのタイヤ ホイール付きタイヤ 三輪車タイヤ スクーターのタイヤ スタッドレスタイヤ 廃タイヤ オートバイのタイヤ 自動車のタイヤ スノータイヤ,その他,,市では収集できません。（販売店等に相談してください。）,
1801,た,タイヤチェーン(金属製),たいやちぇーん（きんぞくせい）,滑り止めチェーン 車チェーン 自動車用チェーン 車のチェーン 車の滑り止めチェーン タイヤのチェーン ネットチェーン タイアチェーン 自動車チェーン スノーチェーン 自動車のチェーン タイヤスチールチェーン,小物金属,粗大ごみ,排出時に最長辺30cm以上のものは粗大ごみとして出してください。,
1800,た,タイヤチェーン(ゴム製など金属製以外),たいやちぇーん（ごむせいなどきんぞくせいいがい）,滑り止めチェーン 車チェーン 自動車用チェーン サイルチェーン 車のゴム付チェーン 車のチェーン 車の滑り止めチェーン タイヤのチェーン ゴムタイヤチェーン ネットチェーン タイアチェーン 自動車チェーン ゴムチェーン スノーチェーン 自動車のチェーン タイヤゴムチェーン 非金属タイヤチェーン ゴム製タイヤチェーン,普通ごみ,粗大ごみ,排出時に最長辺50cm以上のものは粗大ごみとして出してください。,
1802,た,タイヤチェーンのケース,たいやちぇーんのけーす,,普通ごみ,粗大ごみ,最長辺50cm以上のものは粗大ごみとして出してください。,
1803,た,タイヤチューブ,たいやちゅーぶ,自転車ゴム 自転車部品 タイヤのチューブ 自転車タイヤチューブ 自転車のタイヤチューブ 自転車のチューブ,普通ごみ,,,
1804,た,タイヤホイール・ホイールカバー,たいやほいーるほいーるかばー,アルミホイール 車のホイールキャップ 車のホイールカバー ホイルキャップ タイヤホイル タイヤホイール ホイルカバー タイヤのホイール タイヤホィール タイヤホイールキャップ プラスチックホイールカバー バイクホイール 鉄ホイール タイヤホイールカバー タイヤのホイールカバー,その他,,市では収集できません。（販売店等に相談してください。）,
1862,た,耐油紙(揚げ物が入っていた紙袋),たいゆし（あげものがはいっていたかみぶくろ）,,普通ごみ,,,
1857,た,太陽電池パネル,たいようでんちぱねる,ソーラー電池 ソーラーパネル 太陽光パネル,粗大ごみ,小物金属,最長辺30cm未満のものは小物金属として出してください。/充電池は外して販売店か回収協力店へ依頼してください。,
1809,た,タイルカーペット,たいるかーぺっと,パネルカーペット ジョイントカーペット タイルマット カーペットタイル ユニットカーペット システムカーペット 床化粧材 パネルマット,普通ごみ,粗大ごみ,排出時に最長辺50cm以上のものは粗大ごみとして出してください。,
1806,た,タイル（最長辺10cm未満）,たいる（さいちょうへん10せんちみまん）,Pタイル プラスチックタイル ベランダタイル 素焼きタイル ベランダのマット ガーデニングタイル ピータイル 石タイル フロアタイル 磁器タイル レンガタイル 陶器タイル ガーデンタイル セラミックタイル セラミックタイル,普通ごみ,,ただし、業者が作業したものは市では収集できません。（作業した業者に処理を依頼してください。）,
1807,た,タイル（最長辺50cm未満）,たいる（さいちょうへん50せんちみまん）,Pタイル プラスチックタイル ベランダタイル 素焼きタイル ベランダのマット ガーデニングタイル ピータイル 石タイル フロアタイル 磁器タイル レンガタイル 陶器タイル ガーデンタイル セラミックタイル セラミックタイル,粗大ごみ,,1回につき5個まで無料です。（粗大ごみの申し込みが必要です。）/50cm以上のものは有料です。,
1808,た,タイル（最長辺50cm以上）,たいる（さいちょうへん50せんちいじょう）,Pタイル プラスチックタイル ベランダタイル 素焼きタイル ベランダのマット ガーデニングタイル ピータイル 石タイル フロアタイル 磁器タイル レンガタイル 陶器タイル ガーデンタイル セラミックタイル セラミックタイル,粗大ごみ,,ただし、業者が作業したものは市では収集できません。（作業した業者に処理を依頼してください。）,
1814,た,タオル,たおる,バスタオル ハンドタオル キッチンタオル フェイスタオル ボディタオル ミニタオル 綿タオル,資源集団回収,,布類（古着・古布等）回収にご協力お願いします。（洗ってから出してください。）/資源集団回収で回収ができない場合は拠点回収（WEBで見る）を行っています。/上記での回収が難しい場合や汚れているもの、破けているもの、ぬれているものは普通ごみとして出してください。,http://www.city.kawasaki.jp/kurashi/category/24-1-23-1-1-6-9-0-0-0.html
1820,た,タオル入れ(布製),たおるいれぬのせい,,普通ごみ,,,
1815,た,タオルケット(綿の入ってないもの),たおるけっと,薄がけ布団 キルケット,資源集団回収,,布類（古着・古布等）回収にご協力お願いします。（洗ってから出してください。）/資源集団回収で回収ができない場合は拠点回収（WEBで見る）を行っています。/上記での回収が難しい場合や汚れているもの、破けているもの、ぬれているものは普通ごみとして出してください。,http://www.city.kawasaki.jp/kurashi/category/24-1-23-1-1-6-9-0-0-0.html
1816,た,タオルハンガー（金属製）,たおるはんがー（きんぞくせい）,タオル干し タオル掛け タオルかけ バスタオルハンガー タオルウォーマー タオル掛けハンガー タオルかけハンガー バスタオル掛け,小物金属,粗大ごみ,最長辺30cm以上のものは粗大ごみとして出してください。 ,
1817,た,タオルハンガー（金属製以外）,たおるはんがー（きんぞくせいいがい）,タオル干し タオル掛け タオルかけ バスタオルハンガー タオルウォーマー タオル掛けハンガー タオルかけハンガー バスタオル掛け,普通ごみ,粗大ごみ,最長辺50cm以上のものは粗大ごみとして出してください。,
1818,た,タオルホルダー（金属製）,たおるほるだー（きんぞくせい）,布巾かけ 布巾ホルダー,小物金属,,,
1819,た,タオルホルダー（金属製以外）,たおるほるだー（きんぞくせいいがい）,布巾かけ 布巾ホルダー,普通ごみ,,,
1856,た,高枝切りはさみ,たかえだきりはさみ,高枝切り鋏 枝切りハサミ 剪定ばさみ 枝切りばさみ 刈り込みバサミ 高枝バサミ 高枝切バサミ 高枝切りバサミ 枝切ハサミ 枝切はさみ 庭木はさみ 庭木バサミ 剪定はさみ ガーデニング用品 高枝はさみ 高枝ばさみ 高枝切りばさみ 高枝切はさみ 枝きりバサミ 芝刈りはさみ 草刈りハサミ 枝きりばさみ 高枝切りハサミ 枝切ばさみ 枝きりはさみ 高枝切鋏 高枝切ばさみ 高枝切ハサミ 高枝ハサミ 枝きりハサミ せん定はさみ 糸きりはさみ 断ち枝ハサミ 庭ハサミ 糸切りはさみ,粗大ごみ,,,
3268,ま,薪,たきぎ,,普通ごみ,粗大ごみ,最長辺50cm以上のものは粗大ごみとして出してください。 ,
1866,た,卓上カレンダー,たくじょうかれんだー,リングつきカレンダー,ミックスペーパー,,金属部分は小物金属として出してください。 ,
1870,た,卓上掃除機,たくじょうそうじき,ハンディクリーナー ハンディ掃除機 ハンドクリーナー 小型掃除機 ハンディークリーナー ハンディー掃除機 そうじ機 小形掃除機 ハンド掃除機 コードレス掃除機 バキュームクリーナー 充電クリーナ 充電式クリーナ 充電式掃除機 充電掃除機 コードレスクリーナー 小さな掃除機 カークリーナー 車用掃除機 卓上クリーナー レイコップ,小物金属,粗大ごみ,最長辺30cm以上のものは粗大ごみとして出してください。,
1871,た,卓上鍋(金属製以外),たくじょうなべ（きんぞくせいいがい）,卓上なべ,普通ごみ,,,
1872,た,卓上鍋(金属製),たくじょうなべ（きんぞくせい）,電気なべ 卓上なべ,粗大ごみ,小物金属,最長辺30cm未満のものは小物金属として出してください。,
1868,た,卓上ホルダー(金属製),たくじょうほるだー（きんぞくせい）,携帯ホルダー 携帯充電卓上ホルダー 携帯スタンド 携帯置き スマホスタンド 携帯電話ホルダー,小物金属,,,
1869,た,卓上ホルダー(金属製以外),たくじょうほるだー（きんぞくせいいがい）,携帯ホルダー 携帯充電卓上ホルダー 携帯スタンド 携帯置き スマホスタンド 携帯電話ホルダー,普通ごみ,,,
1867,た,卓上ボール盤,たくじょうぼーるばん,,粗大ごみ,小物金属,最長辺30cm未満のものは小物金属として出してください。,
1876,た,宅配便伝票,たくはいびんでんぴょう,宅急便送付状 宅急便の送り状,ミックスペーパー,,,
1873,た,宅配便を利用する際に使われたダンボール,たくはいびんをりようするさいにつかわれただんぼーる,,資源集団回収,,資源集団回収の回収場所等がわからない場合は生活環境事業所に相談してください。,
1874,た,宅配便を利用する際に使われた緩衝材,たくはいびんをりようするさいにつかわれたかんしょうざい,梱包材 梱包資材 包装用緩衝材,普通ごみ,,宅配便の中身が商品ではない場合の緩衝材は普通ごみとして出してください。ただし、商品が送られてきた場合の緩衝材はプラスチック製容器包装として出してください。（識別表示を確認して出してください。）,
1875,た,宅配便を利用する際に使われた箱類(段ボールでないもの),たくはいびんをりようするさいにつかわれたはこるい,,ミックスペーパー,,,
1823,た,タグピン,たぐぴん,タグひも ループピン タグぴん タグのひも,普通ごみ,,,
1824,た,タグファスナー,たぐふぁすなー,ループロック,小物金属,,,
1905,た,竹馬,たけうま,竹うま たけ馬,粗大ごみ,普通ごみ,排出時に最長辺50cm未満のものは普通ごみとして出してください。,
1900,た,竹シーツ,たけしーつ,,粗大ごみ,普通ごみ,排出時に最長辺50cm未満のものは普通ごみとして出してください。,
1902,た,竹製マット,たけせいまっと,竹マット 竹のカーペット,普通ごみ,粗大ごみ,最長辺50cm以上のものは粗大ごみとして出してください。,
1903,た,竹筒,たけづつ,,普通ごみ,粗大ごみ,最長辺50cm以上のものは粗大ごみとして出してください。,
1901,た,竹ひご,たけひご,,普通ごみ,,,
1904,た,竹踏み,たけふみ,踏み竹 足踏み 青竹踏み 青竹ふみ あおたけふみ 竹ぶみ,普通ごみ,,,
1877,た,凧,たこ,カイト スポーツカイト,普通ごみ,粗大ごみ,最長辺50cm以上のものは粗大ごみとして出してください。,
1878,た,凧糸,たこいと,タコ糸 たこ糸,普通ごみ,,,
1826,た,たたみ,たたみ,タタミ 畳 ユニット畳 たたみマット 置き畳 ,粗大ごみ,,5枚までを1個の粗大ごみとして出すことができます。,
1865,た,卓球台,たっきゅうだい,,粗大ごみ,,,
1911,た,卓球（ピンポン）ラケット,たっきゅうぴんぽんらけっと,卓球ラケット 卓球のラケット ピンポンラケット,普通ごみ,,,
1864,た,卓球ボール,たっきゅうぼーる,卓球球,普通ごみ,,,
1827,た,タックルボックス(金属製以外),たっくるぼっくす（きんぞくせいいがい）,バッカン,普通ごみ,粗大ごみ,最長辺50cm以上のものは粗大ごみとして出してください。,
1828,た,タックルボックス(金属製),たっくるぼっくす（きんぞくせい）,バッカン,粗大ごみ,小物金属,最長辺30cm未満のものは小物金属として出してください。,
1829,た,タッセル,たっせる,,普通ごみ,,,
1830,た,タッチペン（金属製）,たっちぺん（きんぞくせい）,スマートフォンタッチペン スマホタッチペン,小物金属,,,
1831,た,タッチペン（金属製以外）,たっちぺん（きんぞくせいいがい）,スマートフォンタッチペン スマホタッチペン,普通ごみ,,,
1833,た,たとう紙,たとうし,多当紙,ミックスペーパー,,,
1887,た,棚板(金属製),たないた（きんぞくせい）,棚いた,小物金属,粗大ごみ,最長辺30cm以上のものは粗大ごみとして出してください。,
1888,た,棚板(金属製以外),たないた（きんぞくせいいがい）,棚いた,普通ごみ,粗大ごみ,最長辺50cm以上のものは粗大ごみとして出してください。,
