964,け,携帯電話の電池,けいたいでんわのでんち,携帯充電池 携帯電池 携帯電話の電池パック 携帯電話電池パック 携帯の電池パック 携帯電話用バッテリー 携帯電話バッテリー 携帯電話用電池 携帯電話用電池パック 携帯用電池 ケータイ電池 携帯電池パック 携帯電話機用バッテリー スマートフォンの電池 携帯電話のバッテリー 携帯のバッテリー,その他,,専売ショップ等での回収をご利用ください。また、長辺30cm未満で、30cm×15cmの回収ボックスの投入口に入るものは小型家電としても出すことができます。,http://www.city.kawasaki.jp/kurashi/category/24-1-23-1-1-6-9-0-0-0.html
957,け,携帯トイレ(ハンディタイプ),けいたいといれ（はんでぃたいぷ）,トイレパック 非常用トイレ,普通ごみ,,汚物はトイレに流してください。,
959,け,携帯灰皿（金属製）,けいたいはいざら（きんぞくせい）,ポッケロ 吸い殻入れ ポケット灰皿 携帯用灰皿,小物金属,,,
960,け,携帯灰皿（金属製以外）,けいたいはいざら（きんぞくせいいがい）,ポッケロ 吸い殻入れ ポケット灰皿 携帯用灰皿,普通ごみ,,,
965,け,携帯用音楽プレーヤー,けいたいようおんがくぷれーやー,ipod 携帯音楽プレイヤー 携帯音楽プレーヤー CDウオークマン ポータブルCDプレーヤー CDウォークマン MP3プレーヤー ポータブルプレーヤー アイポッド カセットウォークマン デジタルオーディオプレーヤー ミュージックプレイヤー アイポット あいぽっど ネットワークウォークマン 携帯用音楽プレイヤー mp3プレイヤー 音楽機器 ポータブルCDプレイヤー iPod touch ギガビート iPod shuffle ミュージックプレーヤー WALKMAN,小物金属,,長辺30cm未満で、30cm×15cmの回収ボックスの投入口に入るものは小型家電としても出すことができます。,http://www.city.kawasaki.jp/kurashi/category/24-1-23-1-1-6-9-0-0-0.html
958,け,携帯ラジオ,けいたいらじお,トランジスターラジオ トランジスタラジオ ポータブルラジオ ケータイラジオ 小型ラジオ FMラジオ 簡易ラジオ 浴室ラジオ ラジオ時計 ポケットラジオ お風呂ラジオ 防水ラジオ,小物金属,,電池は使用済み乾電池として出してください。/長辺30cm未満で、30cm×15cmの回収ボックスの投入口に入るものは小型家電としても出すことができます。,http://www.city.kawasaki.jp/kurashi/category/24-1-23-1-1-6-9-0-0-0.html
995,け,毛糸,けいと,毛糸玉 手芸糸 毛糸の玉 毛いと,普通ごみ,,,
975,け,警報器,けいほうき,ガス警報器 警報機 ガス漏れ警報器,小物金属,,長辺30cm未満で、30cm×15cmの回収ボックスの投入口に入るものは小型家電としても出すことができます。,http://www.city.kawasaki.jp/kurashi/category/24-1-23-1-1-6-9-0-0-0.html
971,け,計量カップ(金属製),けいりょうかっぷ（きんぞくせい）,米カップ 計量カップ料理用 料理用計量カップ メジャーカップ スチール製の計量カップ 軽量カップ 軽量カップ,小物金属,,,
972,け,計量カップ(金属製以外),けいりょうかっぷ（きんぞくせいいがい）,米カップ 計量カップ料理用 料理用計量カップ メジャーカップ 軽量カップ 軽量カップ,普通ごみ,,,
973,け,計量スプーン(金属製),けいりょうすぷーん（きんぞくせい）,軽量スプーン,小物金属,,,
974,け,計量スプーン(金属製以外),けいりょうすぷーん（きんぞくせいいがい）,プラスチックのスプーン 軽量スプーン,普通ごみ,,,
916,け,ケーキサーバー(金属製),けーきさーばー（きんぞくせい）,,小物金属,,,
917,け,ケーキサーバー(金属製以外),けーきさーばー（きんぞくせいいがい）,,普通ごみ,,,
918,け,ケーキの台紙,けーきのだいし,,普通ごみ,,,
922,け,ケーブル,けーぶる,AVケーブル アンテナケーブル アンテナ線 ケーブル類 スピーカーケーブル ランケーブル LANケーブル 同軸ケーブル USBケーブル オーディオケーブル パソコンケーブル プリンターケーブル PCケーブル 電気のコード ブースターケーブル 電気ケーブル スピーカー線 プラグコード 配線ケーブル USBコード PCコード プリンタケーブル パソコンモデムコード 音声ケーブル 電線 バッテリーケーブル ビデオ端子 AVコード HDML LAN線 導線 HDMIケーブル ビデオケーブル アース線 ネットワークケーブル TV線 USBプラグ ウォークマンコード ラン線 充電ケーブル テレビケーブル パソコンのケーブル 三色コード 3色コード TVケーブル インターネットケーブル 音響ケーブル 楽器ケーブル パソコン用ケーブル ACケーブル 電線ケーブル BSアンテナケーブル 携帯ケーブル 携帯充電ケーブル ギターシールド ピンコード ケーブル線 バッテリー充電ケーブル モジュラーケーブル 三色ケーブル こたつケーブル ステレオケーブル テレビ配線 携帯電話ケーブル ACアダプタケーブル アダプターコード アダプタケーブル テレビアンテナケーブル テレビケーブル線 TVアンテナケーブル ブースターけーぶる 3端子入力コード テレビ接続コード テレビ用コード パラレルケーブル 接続ケーブル 被覆線 BNCケーブル シリアルケーブル モニターケーブル アースコード インターフェースケーブル ステレオミニプラグ VVFケーブル ライトニングケーブル iPhoneケーブル ゲームコード 被覆電線,小物金属,,散乱しないよう束ねて出してください。/長辺30cm未満で、30cm×15cmの回収ボックスの投入口に入るものは小型家電としても出すことができます。,http://www.city.kawasaki.jp/kurashi/category/24-1-23-1-1-6-9-0-0-0.html
923,け,ケーブルステッカー（金属製）,けーぶるすてっかー（きんぞくせい）,,小物金属,,,
924,け,ケーブルステッカー（金属製以外）,けーぶるすてっかー（きんぞくせいいがい）,,普通ごみ,,,
925,け,ケーブルタイ（金属製）,けーぶるたい（きんぞくせい）,コード留め紐 ケーブルとめ ケーブル結束バンド タイラップ インシロック インシュロック 結束用バンド 結束タイ タイバンド タイラップバンド,小物金属,,,
926,け,ケーブルタイ（金属製以外）,けーぶるたい（きんぞくせいいがい）,コード留め紐 ケーブルとめ ケーブル結束バンド タイラップ インシロック インシュロック 結束用バンド 結束タイ タイバンド タイラップバンド,普通ごみ,,,
927,け,ケーブルホルダー（金属製）,けーぶるほるだー（きんぞくせい）,コードまとめ,小物金属,,,
928,け,ケーブルホルダー（金属製以外）,けーぶるほるだー（きんぞくせいいがい）,コードまとめ,普通ごみ,,,
929,け,ケーブルモール,けーぶるもーる,コードカバー 配線カバー プラスチックモール,普通ごみ,,排出時に最長辺50cm以上のものは粗大ごみとして出してください。,
993,け,消しゴム,けしごむ,消ゴム ケシゴム 消しごむ 消しゴムかす 練り消し 練りゴム 砂けしゴム 消しカス 消しくず 砂消しゴム ねりけし キンケシ すなけし,普通ごみ,,,
943,け,化粧スプレー(エアゾール缶),けしょうすぷれーえあぞーるかん,化粧水,空き缶・ペットボトル,,中身を使いきって出してください。（穴あけは不要です。）/プラスチック製のキャップはプラスチック製容器包装として出してください。（識別表示を確認して出してください。）/中身が出せない場合は生活環境事業所に相談してください。,
941,け,化粧スプレー(ガラス製),けしょうすぷれー（がらすせい）,化粧水,普通ごみ,,厚紙等に包み「ワレモノキケン」と表示して出してください。,
942,け,化粧スプレー(プラスチック製),けしょうすぷれーぷらすちっくせい,化粧水 ヘアーウォーター ヘアスタイリング剤,プラスチック製容器包装,,,
947,け,化粧棚,けしょうだな,化粧台,粗大ごみ,普通ごみ,最長辺50cm未満のものは普通ごみとして出してください。,
948,け,化粧箱(紙箱),けしょうばこ（かみばこ）,紙の箱 包装箱 箱紙 歯磨き粉の箱,ミックスペーパー,,,
949,け,化粧板,けしょうばん,化粧版,粗大ごみ,普通ごみ,最長辺50cm未満のものは普通ごみとして出してください。,
944,け,化粧パック,けしょうぱっく,シートパック,普通ごみ,,,
945,け,化粧パフ,けしょうぱふ,コットンパフ 化粧用スポンジ ファンデーションのスポンジ,普通ごみ,,,
950,け,化粧品の容器(びん),けしょうひんのようきびん,化粧水ビン 化粧水のビン 化粧瓶 化粧ビン 化粧品のびん 化粧品びん 化粧品瓶 化粧品容器 マスカラ 除光液 化粧水瓶 化粧びん 化粧品のビン 化粧品のボトル 化粧品ボトル 化粧品ビン 化粧品の瓶 化粧品の空き瓶 ネイルカラー 化粧品ケース 化粧水用ガラス瓶 化粧容器 ポマードのビン けしょうびん 化粧水の瓶 乳液 化粧品ガラス ますから クリーム瓶 クリームのビン 茶色 ビン ハンドクリーム ボディークリーム 化粧品空き瓶 化粧水びん 化粧品ビン 化粧品のガラスビン ネイル瓶 化粧の瓶 乳液のビン ファンデーションの瓶 化粧水ボトル ワンウェイびん 乳液の瓶 化粧品空きビン 化粧水のびん 化粧のビン 化粧水のボトル 化粧水容器 化粧水の容器 日焼け止め 化粧品の空瓶 化粧品空ビン 除光液ビン クレンジングオイル 化粧水ガラスビン 化粧水の容器 化粧水空き瓶 ネイルビン 化粧空き瓶 ハンドクリームの容器 ボディクリーム容器 乳液ボトル 化粧のびん 化粧品のビン容器 エナメルリムーバー ハンドクリームの瓶 ヘアリキッド 化粧水のガラス瓶 マニュキュア空き瓶 ネイルポリッシュ 美容液の容器 化粧品のガラス瓶,普通ごみ,,プラスチック製のふたはプラスチック製容器包装として出してください。（識別表示を確認して出してください。）,
951,け,化粧品の容器(プラスチック製),けしょうひんのようきぷらすちっくせい,化粧品容器 マスカラ 除光液 化粧水 化粧品のボトル 化粧品ボトル アイシャドウ ネイルカラー 化粧品ケース 化粧容器 乳液 アイシャドー ますから ハンドクリーム グロス クリーム容器 リキッドファンデーション ネイル瓶 化粧水ボトル 化粧水のボトル 化粧水容器 化粧チューブ 化粧水の容器 日焼け止め 日焼け止めスプレー クレンジングオイル ボディージェル ボディクリーム 化粧品チューブ 化粧クリームチューブ 化粧品チューブ 洗顔チューブ ハンドクリームの容器 ボディクリーム容器 化粧品のケース 化粧品のプラスチック容器 乳液ボトル 化粧品のポンプ エナメルリムーバー ネイルポリッシュ 美容液の容器 アイシャドーケース ファンデーションケース おしろい チーク ほお紅 ファンデーション,プラスチック製容器包装,,識別表示を確認して出してください。（汚れのひどいものは普通ごみとして出してください。）,
952,け,化粧品の容器のフタ,けしょうひんのようきのふた,化粧ビンのキャップ 化粧容器 化粧品の容器のふた ボディークリーム ハンドクリーム ファンデーションのケース 化粧品のキャップ 化粧水フタ ハンドクリームの容器 ボディクリーム容器,プラスチック製容器包装,,識別表示を確認して出してください。（汚れのひどいものは普通ごみとして出してください。）,
946,け,化粧ポーチ,けしょうぽーち,化粧バッグ バニティケース コスメティックケース メイクポーチ,普通ごみ,,,
991,け,削り節器（金属製）,けずりぶしき（きんぞくせい）,けずりぶし器 かつおぶし削り器 かつお削り器 鰹節削り器 削り節箱,小物金属,,,
992,け,削り節器（金属製以外）,けずりぶしき（きんぞくせいいがい）,けずりぶし器 かつおぶし削り器 かつお削り器 鰹節削り器 削り節箱,普通ごみ,,,
994,け,毛玉取り機,けだまとりき,毛玉とり 毛玉クリーナー 毛玉とりき 毛玉とり機 毛玉取り器,小物金属,,長辺30cm未満で、30cm×15cmの回収ボックスの投入口に入るものは小型家電としても出すことができます。,http://www.city.kawasaki.jp/kurashi/category/24-1-23-1-1-6-9-0-0-0.html
936,け,ケチャップの外包装,けちゃっぷのそとほうそう,ケチャップの包装,プラスチック製容器包装,,識別表示を確認して出してください。,
937,け,ケチャップの容器,けちゃっぷのようき,ケチャップ容器 ケチャップボトル ケチャップの包装,プラスチック製容器包装,,使い切ってから出してください。（識別表示を確認して出してください。）/汚れのひどいものは普通ごみとして出してください。,
977,け,血糖測定器,けっとうそくていき,血糖値測定器,小物金属,,長辺30cm未満で、30cm×15cmの回収ボックスの投入口に入るものは小型家電としても出すことができます。,http://www.city.kawasaki.jp/kurashi/category/24-1-23-1-1-6-9-0-0-0.html
978,け,血糖値センサー,けっとうちせんさー,,小物金属,,長辺30cm未満で、30cm×15cmの回収ボックスの投入口に入るものは小型家電としても出すことができます。,http://www.city.kawasaki.jp/kurashi/category/24-1-23-1-1-6-9-0-0-0.html
976,け,結露シート,けつろしーと,結露防止シート,普通ごみ,,,
996,け,毛抜き・とげ抜き(金属製以外),けぬきとげぬき（きんぞくせいいがい）,刺抜き トゲ抜き,普通ごみ,,,
997,け,毛抜き・とげ抜き(金属製),けぬきとげぬき（きんぞくせい）,刺抜き トゲ抜き,小物金属,,,
938,け,ケミカルライト,けみかるらいと,ルミカ ルミカライト サイリューム サイリュウム コンサートライト 発光スティック サイリウムペンライト サリュームライト,普通ごみ,,,
984,け,牽引ロープ,けんいんろーぷ,,普通ごみ,,,
979,け,健康器具（金属製）,けんこうきぐ（きんぞくせい）,ステッパー ルームバイク ルームランナー ロデオボーイ 運動器具 ランニングマシーン ぶらさがり健康器 レッグマシン レッグマジック ジョーバ スポーツ器具 ダイエット器具 足踏み健康器具 ステップ健康器具 ぶら下がり健康器 トレーニング器具 サーフボーイ 健康機器 ダイエット機具 ウォーキングマシン ゆりっこ ウォーキングマシーン 金魚運動器 アブトロニック エクササイズバイク バランスステッパー アブスライド アブストロニクス ランニングマシン 腹筋マシン ウォークマシン ステッバー ランニングマシン ミニステッパー アップベンチ シットアップベンチ フィットネスマシン ベンチプレス レッグマジックX ベンチプレス フィットネス器具 サイクルマシン 筋トレ用ベンチ アブトロニクス ダイエット機器 エルゴメーター ロデオボウイ 腹筋ローラー エアロマシーン トレーニングマシーン トレーニングマシン 筋トレマシーン ステップマシーン トレーニング機器 レックマジック 運動機器 足踏みステッパー 足踏み機 フットステッパー レッグマシーン ボディブレード 牽引機 トレーニングベンチ ブルワーカー ルームウォーカー ストレッチボード 金魚運動機 電動ウォーカー ブルーワーカー フィットネスローラー ペダル健康器具 フィットネスバイク,粗大ごみ,小物金属,大部分が金属製のものが対象です。/最長辺30cm未満のものは小物金属として出してください。 ,
980,け,健康器具（金属製以外）,けんこうきぐ（きんぞくせいいがい）,ステッパー ルームバイク ルームランナー ロデオボーイ 運動器具 ランニングマシーン ぶらさがり健康器 レッグマシン レッグマジック ジョーバ スポーツ器具 ダイエット器具 足踏み健康器具 ステップ健康器具 ぶら下がり健康器 トレーニング器具 サーフボーイ 健康機器 ダイエット機具 ウォーキングマシン ゆりっこ ウォーキングマシーン 金魚運動器 アブトロニック エクササイズバイク バランスステッパー アブスライド アブストロニクス ランニングマシン 腹筋マシン ウォークマシン ステッバー ランニングマシン ミニステッパー アップベンチ シットアップベンチ フィットネスマシン ベンチプレス レッグマジックX ベンチプレス フィットネス器具 サイクルマシン 筋トレ用ベンチ アブトロニクス ダイエット機器 エルゴメーター ロデオボウイ 腹筋ローラー エアロマシーン トレーニングマシーン トレーニングマシン 筋トレマシーン ステップマシーン トレーニング機器 レックマジック 運動機器 足踏みステッパー 足踏み機 フットステッパー レッグマシーン ボディブレード 牽引機 トレーニングベンチ ブルワーカー ルームウォーカー ストレッチボード 金魚運動機 電動ウォーカー ブルーワーカー フィットネスローラー ペダル健康器具 フィットネスバイク,粗大ごみ,普通ごみ,最長辺50cm未満のものは普通ごみとして出してください。,
981,け,剣山,けんざん,,小物金属,,厚紙等に包み「品名」を表示して出してください。,
939,け,けん玉,けんだま,,普通ごみ,,,
983,け,剣道防具（小手・垂・すね当て）,けんどうぼうぐ（こて・たれ・すねあて）,剣道の防具 剣道の小手 剣道垂れ 剣道具 剣道道具 すね当て 脛あて,普通ごみ,粗大ごみ,最長辺50cm以上のものは粗大ごみとして出してください。,
982,け,剣道防具（面・胴）,けんどうぼうぐ（めん・どう）,剣道の防具 剣道の面 剣道面 剣道具 剣道道具,粗大ごみ,,,
987,け,顕微鏡(金属製),けんびきょう（きんぞくせい）,,小物金属,粗大ごみ,最長辺30cm以上のものは粗大ごみとして出してください。,
986,け,顕微鏡(プラスチック製),けんびきょう（ぷらすちっくせい）,,普通ごみ,粗大ごみ,最長辺50cm以上のものは粗大ごみとして出してください。,
985,け,研磨剤(アルミチューブ),けんまざい（あるみちゅーぶ）,コンパウンド,普通ごみ,,中身を使いきってから出してください。/プラスチック製のキャップはプラスチック製容器包装として出してください。（識別表示を確認して出してください。）,
919,け,ゲートボール(球),げーとぼーる（たま）,,普通ごみ,,,
920,け,ゲートボールのスティック(金属製),げーとぼーるのすてぃっく（きんぞくせい）,ゲートボールスティック,粗大ごみ,小物金属,排出時に最長辺30cm未満のものは小物金属として出してください。,
921,け,ゲートボールのスティック(金属製以外),げーとぼーるのすてぃっく（きんぞくせいいがい）,ゲートボールスティック,粗大ごみ,普通ごみ,排出時に最長辺50cm未満のものは普通ごみとして出してください。,
931,け,ゲームカード（紙製）,げーむかーど（かみせい）,トレカ 野球カード トレーディングカード,ミックスペーパー,,,
930,け,ゲームカード（プラスチック製）,げーむかーど（ぷらすちっくせい）,トレカ 野球カード トレーディングカード,普通ごみ,,,
935,け,ゲーム機(家庭用ゲーム機),げーむきかていようげーむき,PS2 テレビゲーム プレイステーション2 PlayStation ps3 TVゲーム機 プレステ2 ファミコン ゲーム機器 ゲームボーイ PSP 携帯ゲーム機 任天堂64 ニンテンドー64 wiiU xbox ゲーム機本体 スーパーファミコン 任天堂DSi ニンテンドーDSi バーチャルボーイ テレビゲーム機 ドリームキャスト ポータブルゲーム プレーステーション GAMEBOY プレイステーション3 プレステ3 小型ゲーム機 ゲームキューブ ファミリーコンピュータ ポケットステーション ゲーム本体 電子ゲーム ワンダースワン セガサターン 3DS PS4 PSVITA ファミコンゲーム機 ゲームウォッチ pcエンジン ネオジオポケット ファミリーコンピューター メガドライブ ゲーム器 プレイステイション スーファミ テレビゲーム器 wiifit ポータブルゲーム機 Nintendo DS Playstation3 DSライト プレステーション2本体 Nintendo Switch Nintendo ２DS,小物金属,粗大ごみ,最長辺30cm以上のものは粗大ごみとして出してください。/長辺30cm未満で、30cm×15cmの回収ボックスの投入口に入るものは小型家電としても出すことができます。,http://www.city.kawasaki.jp/kurashi/category/24-1-23-1-1-6-9-0-0-0.html
932,け,ゲームコントローラー,げーむこんとろーらー,ゲーム機のコントローラー wiiフィットボード アーケードコントローラ ゲームのコントローラー アーケードスティック ゲーム用コントローラ,小物金属,粗大ごみ,最長辺30cm以上のものは粗大ごみとして出してください。/長辺30cm未満で、30cm×15cmの回収ボックスの投入口に入るものは小型家電としても出すことができます。,http://www.city.kawasaki.jp/kurashi/category/24-1-23-1-1-6-9-0-0-0.html
933,け,ゲームソフト(ケース含む),げーむそふと,ゲームカセット ファミコンカセット ファミコンソフト ゲームケース ゲームのケース テレビゲームソフト DSソフトケース ソフトウェア プレイステーションソフト DSライト ゲームソフトケース ゲームソフトケース,小物金属,粗大ごみ,最長辺30cm以上のものは粗大ごみとして出してください。/長辺30cm未満で、30cm×15cmの回収ボックスの投入口に入るものは小型家電としても出すことができます。,http://www.city.kawasaki.jp/kurashi/category/24-1-23-1-1-6-9-0-0-0.html
934,け,ゲームパッド,げーむぱっど,ジョイパッド,小物金属,粗大ごみ,最長辺30cm以上のものは粗大ごみとして出してください。/長辺30cm未満で、30cm×15cmの回収ボックスの投入口に入るものは小型家電としても出すことができます。,http://www.city.kawasaki.jp/kurashi/category/24-1-23-1-1-6-9-0-0-0.html
940,け,下駄箱,げたばこ,シューズボックス 靴の棚 靴棚 シューズラック げた箱 靴入れ 靴ラック シューズ入れ 組み立て下駄箱 靴いれ 靴おき 靴置き スチール製下駄箱,粗大ごみ,普通ごみ,排出時に最長辺50cm未満のものは普通ごみとして出してください。,
990,け,弦,げん,ギターの弦 ギター弦 ガット チェロの弦,普通ごみ,,,
989,け,弦（金属製）,げん（きんぞくせい）,ギターの弦 ギター弦 ガット スチール弦 チェロの弦,小物金属,,,
988,け,原稿用紙,げんこうようし,,ミックスペーパー,,,
1108,こ,鯉のぼり,こいのぼり,,普通ごみ,粗大ごみ,排出時に最長辺50cm以上のものは粗大ごみとして出してください。,
1109,こ,鯉のぼりのポール,こいのぼりのぽーる,こいのぼりのポール,粗大ごみ,,概ね2mを超えるものは市では収集できません。（販売店等に相談してください。）,
1001,こ,コイル,こいる,,小物金属,,,
1002,こ,コイン（金属製）,こいん（きんぞくせい）,外貨 ゲームコイン 硬貨,小物金属,,,
1003,こ,コイン（金属製以外）,こいん（きんぞくせいいがい）,外貨 ゲームコイン 硬貨,普通ごみ,,,
1004,こ,コインケース（金属製）,こいんけーす（きんぞくせい）,,小物金属,粗大ごみ,最長辺30cm以上のものは粗大ごみとして出してください。,
