3142,ほ,干物用ざる （金属製）,ひものようざる（きんぞくせい）,笊,粗大ごみ,小物金属,最長辺30cm未満のものは小物金属として出してください。,
3143,ほ,干物用ざる（金属製以外）,ひものようざる（きんぞくせいいがい）,笊,粗大ごみ,普通ごみ,最長辺50cm未満のものは普通ごみとして出してください。,
2740,ひ,百科事典,ひゃっかじてん,,資源集団回収,,資源集団回収の回収場所等がわからない場合は生活環境事業所に相談してください。,
2686,ひ,ヒューズ,ひゅーず,,普通ごみ,,,
2743,ひ,表札(石製),ひょうさついしせい,門札 石の表札,普通ごみ,,,
2742,ひ,表札(金属製),ひょうさつ（きんぞくせい）,門札,小物金属,粗大ごみ,最長辺30cm以上のものは粗大ごみとして出してください。,
2744,ひ,表札(木製・プラスチック製),ひょうさつ（もくせい・ぷらすちっくせい）,門札,普通ごみ,,,
2745,ひ,表示灯,ひょうじとう,,小物金属,粗大ごみ,最長辺30cm以上のものは粗大ごみとして出してください。,
2690,ひ,ひょうたん,ひょうたん,瓢箪,普通ごみ,,,
2741,ひ,氷のう,ひょうのう,氷嚢,普通ごみ,,,
2725,ひ,日よけ(カー用品),ひよけ（かーようひん）,サンシールド フロントサンシェード 車の日除け 断熱マット 車の日よけ カーシェード サンシェイド ポップアップテント 車用日除け 車用サンシェード 日除けシェード,普通ごみ,粗大ごみ,排出時に最長辺50cm以上のものは粗大ごみとして出してください。,
2727,ひ,日除けスクリーン,ひよけすくりーん,オーニング 日よけ 日よけシェード ベランダ目隠しシート 日除けシート 目隠しシート 日除けシェード,粗大ごみ,,,
2726,ひ,日よけテント,ひよけてんと,簡易テント ビーチテント ツェルト ワンタッチテント,普通ごみ,粗大ごみ,排出時に最長辺50cm以上のものは粗大ごみとして出してください。,
2728,ひ,肥料,ひりょう,堆肥 ガーデニング用品 園芸用肥料 化学肥料 バーク バーク堆肥 ピートモス 園芸肥料 有機肥料,普通ごみ,,液体のものは布等に染み込ませて出してください。,
2729,ひ,肥料袋・土の袋（プラスチック製）,ひりょうぶくろ・つちのふくろ（ぷらすちっくせい）,ガーデニング用品 肥料の袋 化学肥料袋 土袋,プラスチック製容器包装,,識別表示を確認して出してください。,
2730,ひ,肥料袋・土の袋（布製）,ひりょうぶくろ（ぬのせい）,ガーデニング用品 肥料の袋 化学肥料袋 土袋,普通ごみ,,,
2632,ひ,BCジャケット,びーしーじゃけっと,,普通ごみ,粗大ごみ,排出時に最長辺50cm以上のものは粗大ごみとして出してください。,
2641,ひ,ビーズ(ガラス製),びーずがらすせい,ガラスビーズ,普通ごみ,,,
2642,ひ,ビーズ(木・プラスチック製),びーずきぷらすちっくせい,アクアビーズ パウダービーズ ナイロンビーズ アイロンビーズ プラスチックビーズ 木製ビーズ,普通ごみ,,,
2643,ひ,ビーズクッション,びーずくっしょん,,普通ごみ,粗大ごみ,最長辺50cm以上のものは粗大ごみとして出してください。（座布団・クッションをを5枚で1個の粗大ごみとして出すことができます。）,
2654,ひ,ビー玉,びーだま,ビーダマ ビー球,普通ごみ,,,
2645,ひ,ビーチボール,びーちぼーる,,普通ごみ,,,
2646,ひ,ビート板,びーとばん,ビートバン ビートばん,普通ごみ,粗大ごみ,最長辺50cm以上のものは粗大ごみとして出してください。,
2631,ひ,BB弾,びーびーだん,ビービー弾,普通ごみ,,,
2652,ひ,ビール缶,びーるかん,金属容器 ビールのアルミ缶 ビールの缶,空き缶・ペットボトル,,,
2648,ひ,ビールケース,びーるけーす,ビール瓶ケース お酒ケース 一升瓶ケース ビールの箱 ビールラック,その他,,販売店等に相談してください。/難しい場合は「ごみです。」と表示して普通ごみとして出してください。（最長辺50cm未満）,
2649,ひ,ビールサーバー,びーるさーばー,,粗大ごみ,小物金属,最長辺30cm未満のものは小物金属として出してください。,
2653,ひ,ビール箱(段ボール),びーるばこ（だんぼーる）,缶箱,資源集団回収,,資源集団回収の回収場所等がわからない場合は生活環境事業所に相談してください。,
2650,ひ,ビールびん,びーるびん,ビールビン ビールの瓶 ビール瓶 瓶ビール リターナブルびん ビール瓶の蓋,その他,,販売店又は資源集団回収として出してください。/資源集団回収の回収場所は生活環境事業所に相談してください。/難しい場合は空きびんとして出してください。,
2651,ひ,ビールびんのフタ,びーるびんのふた,ビール瓶のふた 飲料のふた おうかん 王冠 瓶ビールのフタ ビールビンの蓋 ビールビンのフタ ビールビンフタ,空き缶・ペットボトル,,,
2734,ひ,美顔器,びがんき,美顔機 美容機器 洗顔器 超音波美顔器 美顔器具,小物金属,,電池は使用済み乾電池として出してください。/ 充電池式(電池が外せない)のものは販売店・メーカーへ相談してください。,
2655,ひ,ビク(魚籠),びく,,普通ごみ,,,
2664,ひ,ビデオカメラ,びでおかめら,8ミリカメラ HDDカメラ ハンディーカム ムービーカメラ ハンディカム 8ミリビデオカメラ ハンディーカムビデオ 8ミリのカメラ ハンディビデオ,小物金属,,長辺30cm未満で、30cm×15cmの回収ボックスの投入口に入るものは小型家電としても出すことができます。,http://www.city.kawasaki.jp/kurashi/category/24-1-23-1-1-6-9-0-0-0.html
2665,ひ,ビデオテープ(ケースも含む),びでおてーぷ（けーふもふくむ）,ビデオテープのケース VHSテープ ビデオテープケース ビデオカセット ビデオのケース ビデオケース 磁気テープ ビデオカセットテープ VTRテープ カセットビデオ 録画テープ 8mmテープ 8mmビデオテープ アダルトビデオ vhsカセット VHSビデオテープ 8ミリビデオカセット,普通ごみ,,ビデオテープ（ケースを含む）はプラスチック製品なので、プラスチック製容器包装ではなく、普通ごみとして出してください。,
2666,ひ,ビデオデッキ,びでおでっき,ビデオカセットレコーダ ビデオテープレコーダー ビデオレコーダー VHSデッキ VHSビデオデッキ ビデオ機器 VHSプレイヤー ビデオプレイヤー VIDEOレコーダー VTRデッキ ビデオカセットデッキ ビデオカセットレコーダー ビデオプレーヤー VHSレコーダー ビデオデッキカセットレコーダー ビデオDVDデッキ 8ミリビデオデッキ,粗大ごみ,小物金属,最長辺30cm未満のものは小物金属として出してください。/長辺30cm未満で、30cm×15cmの回収ボックスの投入口に入るものは小型家電としても出すことができます。,http://www.city.kawasaki.jp/kurashi/category/24-1-23-1-1-6-9-0-0-0.html
2668,ひ,ビニールカーテン,びにーるかーてん,カフェカーテン ナイロンカーテン ビニールのカーテン,普通ごみ,粗大ごみ,排出時に最長辺50cm以上のものは粗大ごみとして出してください。,
2669,ひ,ビニールカバー,びにーるかばー,,普通ごみ,,,
2670,ひ,ビニールケース,びにーるけーす,,普通ごみ,,,
2671,ひ,ビニールコーティング紙,びにーるこーてぃんぐし,ビニールコート紙 ビニールコーティングした紙,ミックスペーパー,,,
2672,ひ,ビニールタイ,びにーるたい,ビニタイ ワイヤータイ ねじりっこ 針金モール エスタイ ポップタイ ねじりこ タフロープ ラッピング紐 ラッピングタイ 結束ワイヤー ツイストタイ 針金入りビニールひも ビニールはりがね ビニール針金 ツイストテープ ビニールコーティング針金 被覆針金,普通ごみ,,,
2679,ひ,ビニール手袋,びにーるてぶくろ,ポリ手袋 炊事手袋 ビニール手ぶくろ ディスポーザブル手袋 ポリエチレン手袋 使い捨て手袋 炊事用手袋 ディスポグローブ,普通ごみ,,,
2673,ひ,ビニールトタン,びにーるとたん,ビニール波板 波トタン プラスチックトタン プラスチック製波板 プラスチック波板 プラスチック製波板 ポリカ波板 塩化ビニール波板 ビニールとたん,粗大ごみ,普通ごみ,姿見・つい立（板状）・トタン板・波板・風呂ふた・コタツ板・額縁・ベニヤ板・すのこ・鉄板類・ホワイトボード（板のみ）・黒板（板のみ）・一斗缶（板状につぶしたもの）・つっぱり棚は、5枚を1個の粗大ごみとして出すことができます。/最長辺50cm未満のものは普通ごみとして出してください。,
2674,ひ,ビニールバケツ,びにーるばけつ,,普通ごみ,粗大ごみ,最長辺50cm以上のものは粗大ごみとして出してください。（5個までを1個の粗大ごみとして出すことができます。）,
2675,ひ,ビニールひも,びにーるひも,スズランテープ ビニールヒモ ビニール紐 ビニールテープ すずらんテープ プラスチック製荷造りひも 荷造り紐 荷造りヒモ ビニルひも ビニル紐 パッキングロープ 梱包用ヒモ PPひも 荷作りひも 荷物ヒモ 荷造り用ひも ビニール製ひも 梱包用ビニールテープ 荷ひも くくり紐 PP紐 PPテープ 梱包用紐 梱包ビニール紐 梱包用ひも ピーピーテープ ビニールロープ 梱包の紐 梱包用のヒモ 梱包用の紐 梱包用ビニールひも ビニールの紐 荷造りビニールひも PPロープ,普通ごみ,,,
2681,ひ,ビニール封筒,びにーるふうとう,,普通ごみ,,,
2680,ひ,ビニール袋(商品として購入したもの),びにーるふくろしょうひんとしてこうにゅうしたもの,ポリ袋 ごみ袋 ゴミ袋 ビニールの袋 半透明の袋 ビニールぶくろ 黒ビニール袋 フリーズパック タフレン オリーブ油 セレ袋 ポリエチレン製の袋 ポリプロピレン製の袋 プラスチック袋 プラスティック袋 ポリエチレン容器 ポリ塩化ビニルの袋 ユニパック ナイロン袋 プラスチック製の袋 プラスチック製袋 プラの袋 プラ袋 ナイロン製袋 pp袋 ビニル袋,普通ごみ,,ビニール袋を商品として購入したものは、プラスチック製容器包装ではなく普通ごみとして出してください。,
2676,ひ,ビニールプール,びにーるぷーる,子供用プール 幼児プール ベビープール 家庭用プール 簡易プール 幼児用プール 子供プール,普通ごみ,粗大ごみ,排出時に最長辺50cm以上のものは粗大ごみとして出してください。,
2682,ひ,ビニール包装材(商品として購入したもの),びにーるほうそうざい（しょうひんとしてこうにゅうしたもの）,,普通ごみ,,ビニール包装材を商品として購入したものは、プラスチック製容器包装ではなく普通ごみとして出してください。,
2677,ひ,ビニールボート,びにーるぼーる,,普通ごみ,粗大ごみ,排出時に最長辺50cm以上のものは粗大ごみとして出してください。,
2678,ひ,ビニールマット,びにーるまっと,ビニールカーペット ビニルマット,普通ごみ,,,
2687,ひ,ビューラー(金属製),びゅーらー（きんぞくせい）,,小物金属,,,
2688,ひ,ビューラー(金属製以外),びゅーらー（きんぞくせいいがい）,,普通ごみ,,,
2689,ひ,ビューラーゴム,びゅーらーごむ,,普通ごみ,,,
2746,ひ,屏風,びょうぶ,,粗大ごみ,普通ごみ,最長辺50cm未満のもの(ミニチュア版)は普通ごみとして出してください。,
2735,ひ,美容ローラー(機械式以外),びようろーらー（きかいしきいがい）,マッサージローラー 美顔ローラー 小顔ローラー ゲルマローラー フェイスローラー,普通ごみ,,,
2736,ひ,美容ローラー(金属製),びようろーらー（きかいしき）,マッサージローラー 美顔ローラー 小顔ローラー ゲルマローラー フェイスローラー,小物金属,粗大ごみ,最長辺30cm以上のものは粗大ごみとして出してください。,
2691,ひ,ビリヤード台,びりやーどだい,,粗大ごみ,,,
2695,ひ,ビルトインコンロ(自分で取り外したもの),びるといんこんろじぶんでとりはずしたもの,ビルトインガス台,粗大ごみ,,ただし、業者が作業したものは市では収集できません。（作業した業者に処理を依頼してください。）,
2696,ひ,ビンゴカード,びんごかーど,ビンゴマシーン,ミックスペーパー,,,
2697,ひ,ビンゴボール(金属製),びんごぼーるきんぞくせい,ビンゴマシーン,小物金属,,,
2698,ひ,ビンゴボール(金属製以外),びんごぼーるきんぞくせいいがい,ビンゴマシーン,普通ごみ,,,
2699,ひ,ビンゴマシーン,びんごましーん,ビンゴの機械,小物金属,,,
2704,ひ,ビンディング（金属製）,びんでぃんぐ（きんぞくせい）,バインディング スノーボードビンディング,小物金属,,,
2705,ひ,ビンディング（金属製以外）,びんでぃんぐ（きんぞくせいいがい）,バインディング スノーボードビンディング,普通ごみ,,,
2706,ひ,びんのフタ(金属製),びんのふたきんぞくせい,ジャムのフタ 酒のビンのふた ビンのフタ ビンの蓋 瓶のふた 王冠 ジャムのびんのふた 缶ビールの王冠 瓶の蓋 ジャムのふた ドリンク剤のふた 瓶キャップ スクリューキャップ 薬のふた 薬の蓋 瓶のキャップ シャンパンの金属製ふた ビール瓶ふた ビンふた ウィスキーキャップ ジャムの蓋 瓶詰めのふた びんの金属ふた ワンカップのふた ビールの蓋 ワインのふた ビン蓋 薬瓶のふた びんの蓋 ビンキャップ ビール栓 アルミのフタ アルミの蓋 ビールせん ビールの栓 栄養ドリンクのふた 瓶のフタ 酒ビンの蓋 酒瓶のふた 金属のキャップ ガラス瓶のキャップ 飲料ビンのキャップ 飲料ビンの蓋 ビールのせん 瓶のせん オロナミンCキャップ オロナミンCのふた ドリンク剤の蓋 リポビタンDのふた 栄養ドリンクのフタ ガラス瓶のふた 酒びんのキャップ 酒びんの蓋 調味料の蓋 調味料ふた ジャムビンのふた 金属の蓋 化粧品ふた 化粧瓶ふた 金属のふた お酒の蓋 栄養ドリンクの蓋 空き瓶のキャップ 酒ブタ 調味料のふた 調味料キャップ ジャム瓶のふた 栄養ドリンクキャップ ウィスキー瓶のふた ウィスキーのふた アルミ缶のフタ ワインキャップ,空き缶・ペットボトル,,,
2707,ひ,びんのフタ(金属製以外),びんのふたきんぞくせいいがい,ジャムのフタ ビンのふた ビンのフタ ビンの蓋 瓶のふた 瓶の蓋 瓶キャップ 薬のふた 薬の蓋 瓶のキャップ ビンふた 瓶詰めのふた ワインのふた ビン蓋 薬瓶のふた ビンキャップ 瓶のフタ ガラス瓶のキャップ 飲料ビンのキャップ 飲料ビンの蓋 ガラス瓶のふた 化粧品ふた 化粧瓶ふた お酒の蓋 コーヒービンのふた 栄養ドリンクの蓋 空き瓶のキャップ 調味料のふた 調味料キャップ ジャム瓶のふた 栄養ドリンクキャップ ウィスキー瓶のふた ウィスキーのふた,普通ごみ,プラスチック製容器包装,プラスチック製のフタはプラスチック製容器包装として出してください。（識別表示を確認して出してください。）,
2638,ひ,ピアッサー,ぴあっさー,,小物金属,,厚紙等に包み「刃物キケン」と表示して出してください。,
2639,ひ,ピアノ,ぴあの,アップライトピアノ 鍵盤楽器 DGP5 エレピアノ 電気ピアノ,その他,,市では収集できません。（販売店等に相談してください。）,
2640,ひ,ピアノカバー,ぴあのかばー,,普通ごみ,,,
2634,ひ,PCケース(金属製),ぴーしーけーす（きんぞくせい）,パソコンケース タワーケース PC筐体 ,小物金属,,最長辺30cm以上のものは粗大ごみとして出してください。,
2633,ひ,PCケース(ノートパソコンカバー:布製・プラスチック製),ぴーしーけーす（のーとぱそこんかばー）,パソコンケース パソコン筐体 ,普通ごみ,粗大ごみ,最長辺50cm以上のものは粗大ごみとして出してください。,
2635,ひ,PCスタンド,ぴーしーすたんど,,粗大ごみ,小物金属,最長辺30cm以下のものは小物金属として出してください。,
2636,ひ,PDA,ぴーでぃーえー,モバイルギア nexus,小物金属,,,
2637,ひ,P箱,ぴーばこ,お酒のケース 酒瓶ケース,その他,,販売店等に相談してください。/難しい場合は「ごみです。」と表示して普通ごみとして出してください。（最長辺50cm未満）,
2647,ひ,ピーラー,ぴーらー,ピューラー 皮むき器 皮むき機 皮引き 皮剥き 皮むきき かわむき 皮剥き器 野菜の皮むき器,小物金属,,,
2656,ひ,ピクチャーレール,ぴくちゃーれーる,ハンガーレール,粗大ごみ,小物金属,最長辺30cm未満のものは小物金属として出してください。,
2657,ひ,ピザカッター,ぴざかったー,パイカッター,小物金属,,,
2658,ひ,ピザストーン,ぴざすとーん,,普通ごみ,粗大ごみ,最長辺50cm以上のものは粗大ごみとして出してください。,
2659,ひ,ピザの箱,ぴざのはこ,ピザ箱 ピザの空き箱 ピザのはこ ピザのボックス 宅配ピザの箱 ピザダンボール ピザの外箱,普通ごみ,,,
2663,ひ,ピッケル,ぴっける,,小物金属,粗大ごみ,最長辺30cm以上のものは粗大ごみとして出してください。,
2683,ひ,ピペット,ぴぺっと,スポイト 駒込ピペット ガラススポイト 化粧スポイト,普通ごみ,,,
2694,ひ,ピルケース(金属製),ぴるけーすきんぞくせい,ドラッグ クスリ サプリ 薬入れ 薬ケース 薬容器 クスリの入れ物 サプリケース,小物金属,,,
2692,ひ,ピルケース(薬を購入した時のもの・プラスチック製),ぴるけーす（くすりをこうにゅうしたときのもの・ぷらすちっくせい）,ドラッグ クスリ サプリ 薬入れ 薬ケース 薬容器 クスリの入れ物 サプリケース,プラスチック製容器包装,,,
2693,ひ,ピルケース(商品として購入したもの・プラスチック製),ぴるけーす（くすりをこうにゅうしたときのもの・ぷらすちっくせい）,ドラッグ クスリ サプリ 薬入れ 薬ケース 薬容器 クスリの入れ物 サプリケース,普通ごみ,,ピルケースを商品として購入したものは、プラスチック製容器包装ではなく普通ごみとして出してください。,
2700,ひ,ピンセット（金属製）,ぴんせっと（きんぞくせい）,,小物金属,,,
2701,ひ,ピンセット（金属製以外）,ぴんせっと（きんぞくせいいがい）,,普通ごみ,,,
2702,ひ,ピンチハンガー(プラスチック製),ぴんちはんがー,洗濯角ハンガー ピンチ ピッチハンガー 洗濯ハンガー 物干しハンガー 洗濯用ハンガー 10連ハンガー ハンガーピンチ 角型ハンガー 洗濯物ハンガー 洗たくハンガー 洗濯干し器具 洗濯ピンチハンガー 洗濯物干しハンガー パラソルハンガー 折りたたみハンガー せんたくハンガー 洗濯掛け カクハンガー タコ足ハンガー 洗濯物干しピンチハンガー 小物干し 洗濯干しハンガー 洗濯干しピンチ たこあしハンガー 蛸足ハンガー プラスチック角ハンガー 角形ハンガー 洗濯物のハンガー 洗濯物ピンチハンガー アルミ角ハンガー ピンチつきハンガー ランドリーハンガー 洗濯バサミハンガー 洗濯用ピンチ 角ピンチハンガー スクエアハンガー,普通ごみ,粗大ごみ,排出時に最長辺50cm以上のものは粗大ごみとして出してください。,
2703,ひ,ピンチハンガー(金属製),ぴんちはんがーきんぞくせい,洗濯角ハンガー ピンチ ピッチハンガー 洗濯ハンガー 物干しハンガー 洗濯用ハンガー 11連ハンガー ハンガーピンチ 角型ハンガー 洗濯物ハンガー 洗たくハンガー 洗濯干し器具 洗濯ピンチハンガー 洗濯物干しハンガー パラソルハンガー 折りたたみハンガー せんたくハンガー ステンレスピンチハンガー 洗濯掛け タコ足ハンガー 洗濯物干しピンチハンガー 小物干し 洗濯干しハンガー 洗濯干しピンチ たこあしハンガー 蛸足ハンガー 角形ハンガー 洗濯物のハンガー 洗濯物ピンチハンガー ピンチつきハンガー ランドリーハンガー 洗濯バサミハンガー 洗濯用ピンチ 角ピンチハンガー ステンレス角ハンガー アルミ洗濯干し ステンレス製洗濯ハンガー スクエアハンガー,小物金属,粗大ごみ,排出時に最長辺30cm以上のものは粗大ごみとして出してください。,
2708,ひ,ピンバッジ,ぴんばっじ,ビンバッヂ ピンズ ピンバッヂ,小物金属,,,
2709,ひ,ピンバッチ,ぴんばっち,缶ばっち,小物金属,,,
2710,ひ,ピンポン(卓球)玉,ぴんぽん（たっきゅう）たま,ピンポン玉 ピンポン球 卓球球,普通ごみ,,,
2751,ふ,ファイル(紙製),ふぁいる,キングファイル リングファイル ドッチファイル チューブファイル 金具付きファイル 紙ファイル ドッジファイル パイプファイル フラットファイル バインダーファイル 紙ファィル 2穴ファイル リングつきファイル リング式ファイル,ミックスペーパー,,,
2752,ふ,ファイルケース（紙製）,ふぁいるけーす（かみせい）,ボックスファイルボックス ファイリングケース,ミックスペーパー,,,
2753,ふ,ファイルケース（プラスチック製）,ふぁいるけーす（ぷらすちっくせい）,ボックスファイルボックス ファイリングケース,普通ごみ,,,
2754,ふ,ファイルスタンド(金属製),ふぁいるすだんど（きんぞくせい）,ファイルホルダー,小物金属,,,
2755,ふ,ファイルスタンド(プラスチック製),ふぁいるすだんど（ぷらすちっくせい）,ファイルホルダー,普通ごみ,,,
2757,ふ,ファイルの留め具・カードリング(金属製),ふぁいるのとめぐきんぞくせい,キングファイル リングファイル ドッチファイル チューブファイル 金具付きファイル ドッジファイル パイプファイル バインダーファイル ファイルの金具,小物金属,,,
2756,ふ,ファイルの留め具・カードリング(プラスチック製),ふぁいるのとめぐぷらすちっくせい,キングファイル リングファイル ドッチファイル チューブファイル 金具付きファイル ドッジファイル パイプファイル バインダーファイル ファイルの金具,普通ごみ,,,
2750,ふ,ファイル(プラスチック製),ふぁいるぷらすちっくせい,キングファイル リングファイル ドッチファイル チューブファイル 金具付きファイル ドッジファイル パイプファイル ポケットファイル バインダーファイル ファイルフォルダー 2穴ファイル プラスチックファイル リング式ファイル ホップリングファイル PPファイル プラスチックバインダー,普通ごみ,,,
2758,ふ,ファクシミリ,ふぁくしみり,FAX電話器 FAX付き電話 FAX電話機 FAX機 FAXでんわ ファックス機 ファックス複合機 ファックス付き電話 電話FAX複合機 電話複合機 家庭用FAX FAX付き電話機 家庭用ファックス 複合ファックス,粗大ごみ,小物金属,最長辺30cm未満のものは小物金属として出してください。/長辺30cm未満で、30cm×15cmの回収ボックスの投入口に入るものは小型家電としても出すことができます。,http://www.city.kawasaki.jp/kurashi/category/24-1-23-1-1-6-9-0-0-0.html
2759,ふ,ファンシーケース,ふぁんしーけーす,,粗大ごみ,普通ごみ,最長辺50cm未満のものは普通ごみとして出してください。,
2749,ふ,ファー,ふぁー,フェイクファー ラビットファ,普通ごみ,,,
